{
    "ksml_version": "0.2.0",
    "metadata": {
        "id": "550e8400-e29b-41d4-a716-446655440000",
        "author": "KSML Team",
        "title": "v0.2 Feature Showcase",
        "description": "Demonstrates new v0.2 capabilities",
        "created_at": "2024-01-01T00:00:00Z",
        "version": "1.0.0",
        "environment": "development",
        "dependencies": [
            {
                "name": "external-service",
                "version": "2.1.0",
                "source": "https://api.example.com"
            }
        ],
        "tags": [
            "demo",
            "v0.2",
            "features"
        ]
    },
    "configurations": {
        "max_retries": 5,
        "timeout_seconds": 300
    },
    "steps": [
        {
            "name": "Initialize System",
            "action": "system_init",
            "description": "Initialize the system with enhanced configuration",
            "parameters": {
                "target": "main_system",
                "value": true,
                "options": {
                    "mode": "enhanced",
                    "debug": "false"
                }
            },
            "timeout_override": 120,
            "retry_policy": {
                "max_attempts": 3,
                "backoff_seconds": 10
            },
            "conditions": [
                {
                    "type": "run_if",
                    "expression": "environment == 'development'"
                }
            ]
        },
        {
            "name": "Process Data",
            "action": "data_process",
            "parameters": {
                "target": "data_pipeline",
                "value": "batch_001"
            },
            "on_failure": "retry",
            "conditions": [
                {
                    "type": "skip_if",
                    "expression": "data_empty == true"
                }
            ]
        }
    ],
    "extensions": {
        "x-capabilities": [
            "retry",
            "timeout",
            "conditional"
        ],
        "x-metadata-extensions": {
            "schema_url": "https://schemas.example.com/custom",
            "validation_mode": "strict"
        }
    }
}